{
  "$schema": "https://json-schema.org/draft/2020-12/schema",
  "$id": "https://github.com/agent4math/paper-parser/schema/manifest.schema.json",
  "title": "PaperParser manifest.json schema",
  "description": "Schema for the manifest file of a PaperParser bundle. Captures paper metadata, analysis scope, and producer information.",
  "type": "object",
  "additionalProperties": false,
  "required": ["schema_version", "created_at", "paper", "scope", "producer"],
  "properties": {
    "schema_version": {
      "type": "string",
      "const": "0.2.0",
      "description": "Semver version of the PaperParser schema specification."
    },
    "created_at": {
      "type": "string",
      "format": "date-time",
      "description": "ISO 8601 timestamp of bundle creation."
    },
    "paper": {
      "type": "object",
      "description": "Metadata about the paper being analyzed.",
      "additionalProperties": false,
      "required": ["title", "authors", "year", "subject_area", "source_type", "source_files"],
      "properties": {
        "title": {
          "type": "string",
          "minLength": 1,
          "description": "Full title of the paper."
        },
        "authors": {
          "type": "array",
          "minItems": 1,
          "items": {
            "type": "string",
            "minLength": 1
          },
          "description": "Ordered list of author names as they appear on the paper."
        },
        "arxiv_id": {
          "type": "string",
          "pattern": "^[0-9]{4}\\.[0-9]{4,5}(v[0-9]+)?$",
          "description": "arXiv identifier including optional version suffix (e.g., '2401.12345v2')."
        },
        "doi": {
          "type": "string",
          "pattern": "^10\\.",
          "description": "Digital Object Identifier (must start with '10.')."
        },
        "year": {
          "type": "integer",
          "minimum": 1900,
          "maximum": 2100,
          "description": "Publication or preprint year."
        },
        "subject_area": {
          "type": "string",
          "minLength": 1,
          "description": "Primary mathematical subject area. Prefer standard MSC-style descriptions (e.g., 'Functional Analysis', 'Algebraic Geometry', 'Probability Theory')."
        },
        "source_type": {
          "type": "string",
          "enum": ["latex", "markdown", "pdf"],
          "description": "Source format the agent worked from."
        },
        "source_files": {
          "type": "array",
          "minItems": 1,
          "items": {
            "type": "string",
            "minLength": 1
          },
          "description": "List of source file names analyzed. For Markdown input, this is typically ['paper.md']; for PDF input, this is ['paper.pdf'] or similar."
        },
        "version_note": {
          "type": "string",
          "description": "Free-text note about which version of the paper was analyzed."
        }
      }
    },
    "scope": {
      "type": "object",
      "description": "What was included in the analysis.",
      "additionalProperties": false,
      "required": ["sections_included", "analysis_level"],
      "properties": {
        "sections_included": {
          "type": "array",
          "minItems": 1,
          "items": {
            "type": "string",
            "minLength": 1
          },
          "description": "List of section numbers included, or ['all'] for full paper. Examples: ['all'], ['1', '2', '3'], ['3', '4', 'A']."
        },
        "analysis_level": {
          "type": "string",
          "enum": ["bird_eye", "frog_eye", "both"],
          "description": "Depth of analysis: 'bird_eye' (high-level structure only), 'frog_eye' (detailed proof-level), 'both' (full analysis)."
        }
      }
    },
    "producer": {
      "type": "object",
      "description": "Information about the agent/tool that produced this bundle.",
      "additionalProperties": false,
      "required": ["agent", "schema_version", "timestamp_start", "timestamp_end"],
      "properties": {
        "agent": {
          "type": "string",
          "minLength": 1,
          "description": "Identifier for the producing agent (e.g., 'claude-opus-4-6')."
        },
        "schema_version": {
          "type": "string",
          "const": "0.2.0",
          "description": "Schema version the agent targeted. Must match top-level schema_version."
        },
        "timestamp_start": {
          "type": "string",
          "format": "date-time",
          "description": "ISO 8601 timestamp when analysis began."
        },
        "timestamp_end": {
          "type": "string",
          "format": "date-time",
          "description": "ISO 8601 timestamp when analysis completed."
        }
      }
    }
  }
}
